item_num,code,address,action,aye_votes,nay_votes,motion_or_resolution,speakers_count,section,meeting_date
15a,2024-007906GPA,,"Continued to November 7, 2024","Campbell, McGarry, Williams, Braun, Moore, So",None,,0,continuance,2024-10-24
15b,2024-006988PCAMAP,,"Continued to November 7, 2024","Campbell, McGarry, Williams, Braun, Moore, So",None,,0,continuance,2024-10-24
13,2024-008634PCA,,Adopted a Recommendation for Approval with Staff modifications,"Campbell, McGarry, Braun, Moore, So",Williams,21634,3,regular_calendar,2024-10-24
14,2024-008633PCA,524 And 530 Howard Street,Adopted a Recommendation for Approval,"Campbell, McGarry, Williams, Braun, Moore, So",None,21635,2,regular_calendar,2024-10-24
16,2023-011096CUA,225 San Leandro Way – East Side Between Monterey Boulevard,Approved with Conditions as amended by Staff,"Campbell, McGarry, Williams, Braun, Moore, So",None,21636,42,regular_calendar,2024-10-24
17,2024-005356CUA,233 Whitney Street,Approved with Conditions as amended to include:,"McGarry, Williams, Braun, Moore, So",Campbell,21637,18,regular_calendar,2024-10-24
